Title,Group
Chelsea Dealt Another Injury Blow Ahead of Champions League Bout,News
Arsenal Player Ratings vs. Slavia Prague: Gunners Cruise on Historic Night,News
Max Dowman Makes Major Champions League History With European Debut,News
Why Trent Alexander-Arnold Isn’t Starting for Real Madrid vs. Liverpool,News
"Arsenal Learn Viktor Gyokeres Injury Timeline, Return Date Revealed",News
Why Martin Zubimendi Isn’t Playing for Arsenal vs. Slavia Prague,News
"Cristiano Ronaldo Offers Honest Assessment of Ruben Amorim, Man Utd",News
"Desire Doue Crowned 2025 Golden Boy, Succeeds Lamine Yamal",News
David Beckham Joins Illustrious Group to Receive Highest British Honor,News
Agent Arrested After Premier League Player ‘Threatened With Gun’,News
‘I Love Him’—Wayne Rooney Names Surprising Striker Man Utd Should Have Signed,Transfers
Arsenal Battling Rivals for Teenage Record Breaker Backed by Club Legend,Transfers
William Saliba Makes Surprise Admission Over Real Madrid Transfer Interest,Transfers
Harry Kane ‘Considering’ Blockbuster Barcelona Transfer,Transfers
Transfer Rumors: Barcelona Plot Haaland Swap; Liverpool Make Wharton Bid,Transfers
Crystal Palace Chief Drops Marc Guehi Transfer Bombshell,Transfers
Barcelona’s Potential Lewandowski Replacement Wants Transfer ‘Finalized’ in January,Transfers
Man Utd Reveal Transfer Strategy as Results Start to Turn for Ruben Amorim,Transfers
Chelsea to ‘Hold Talks’ With Teenage Talent Amid Uncertain Future,Transfers
Endrick ‘in Talks’ With Surprise Club to Complete Real Madrid Exit,Transfers
Jaedyn Shaw Opens Up About Her Trade to Gotham FC: ‘I Fit Right In’,Women
USWNT Icon Christen Press to Retire at End of 2025 Season,Women
USWNT Roster Takeaways: Trinity Rodman and Jaedyn Shaw Make Triumphant Return,Women
"The Favorites, Storylines and Questions for the 2025–26 Women's Champions League Season",Women
Ranking the Favorites to Win the 2025 Ballon d'Or Féminin,Women
NWSL Matchday 21 Power Rankings: Gotham Rise with Jaedyn Shaw's Dream Debut,Women
‘A Calculated Risk’: New Angel City Star Nealy Martin Opens Up on Gotham Trade,Women
NWSL Matchday 20 Power Rankings: More Misery for Orlando Pride,Women
Alyssa Thompson: USWNT Star Completes Record-Breaking Move to Chelsea,Women
NWSL Matchday 19 Power Rankings: Angel City Back in the Mix After Turnaround,Women